{
  "$schema": "http://json-schema.org/draft-07/schema#",
  "title": "Character Card",
  "description": "Configuration for a Character in Chronicler Engine: a person in a World whom the player does not play.",
  "type": "object",
  "properties": {
    "id": {
      "type": "string"
    },
    "name": { "type": "string" },
    "description": { "type": "string" },
    "personality": { "type": "string" },
    "scenario": { "type": "string" },
    "example_dialogue": { "type": "string" },
    "summary": { "type": ["string", "null"] },
    "profile_image": { "type": ["string", "null"] },
    "headshot_image": { "type": ["string", "null"] },
    "inventory": {
      "type": "array",
      "items": { "type": "string" }
    },
    "triggers": {
      "type": "array",
      "items": {
        "type": "object",
        "properties": {
          "requirement": {
            "type": "object"
          },
          "narration": {
            "type": "object",
            "properties": {
              "name": { "type": "string" },
              "narration_prompt": { "type": "string" }
            },
            "required": ["name", "narration_prompt"]
          },
          "repeat": { "type": "boolean" },
          "room_id": { "type": ["string", "null"] }
        },
        "required": ["requirement", "narration"]
      }
    },
    "relationships": {
      "type": "array",
      "items": {
        "type": "object",
        "properties": {
          "with": { "type": "string" },
          "static": { "type": "string" },
          "dynamic": { "type": "string" }
        },
        "required": ["with", "static"]
      }
    }
  },
  "required": ["name", "description", "personality", "scenario"]
}
